{
  "schemaVersion": "1.0",
  "eventId": "7b2fb7ac-e074-4aaf-b73a-3128f914ef34",
  "incidentId": "52d5c9db-e097-4656-af2e-84b96fc56b32",
  "cameraId": "camera-demo-01",
  "trackId": "track-7",
  "zoneId": "rear-entry",
  "eventType": "zone_intrusion",
  "riskLevel": 2,
  "occurredAt": "2026-09-16T00:00:01Z",
  "sourceTimeMs": 1250,
  "armed": true,
  "reasonCodes": ["person_present", "armed_zone_entry"],
  "components": {
    "detector": "scripted-v1",
    "tracker": "scripted-v1",
    "riskEngine": "rules-v1",
    "configuration": "golden-default-v1"
  }
}

